{
  "schema_version": "mncs-family-registry.v0.1",
  "registry_id": "mncs-family",
  "name": "MNCS family",
  "description": "Discovery and bootstrap map for the Machine-Native Complexity Standard and the independently owned projects that implement, evaluate, execute, record, and research machine-native computing. Component repositories remain authoritative for their own contracts.",
  "authority": {
    "kind": "discovery-and-bootstrap",
    "does_not_create": [
      "conformance",
      "certification",
      "independent evidence",
      "protected custody",
      "governance approval",
      "PASS",
      "promotion authority"
    ],
    "note": "A successful bootstrap means software was installed and verified against this operational contract. It does not change MNCS or MNCDS claim status."
  },
  "compatibility": {
    "state": "UNKNOWN",
    "note": "No published compatible-set matrix yet. Refs default to each repository's main branch unless an explicit --ref is supplied. Treat cross-component version compatibility as UNKNOWN."
  },
  "profiles": {
    "core": {
      "display_name": "Core",
      "description": "MNCS standard, Python validator, and optional independent Rust validator.",
      "components": ["mncs"],
      "optional_components": ["mncs-validator-rs"]
    },
    "developer": {
      "display_name": "Developer",
      "description": "Core plus the common development stack: MNCDS, Fabric, Harness, Forge, Commons, and Control MCP.",
      "components": [
        "mncs",
        "mncds",
        "mncs-fabric",
        "mncs-commons",
        "mncs-harness",
        "mncs-forge",
        "mncs-control"
      ],
      "optional_components": ["mncs-validator-rs"]
    },
    "worker": {
      "display_name": "Fabric worker",
      "description": "Fabric worker checkout and preflight. Enrollment, certificates, and controller rendezvous remain operator-mediated Fabric operations.",
      "components": ["mncs-fabric"]
    },
    "research": {
      "display_name": "Research",
      "description": "Developer stack plus language, studies, experimental learning, RAVEL, Atlas, lineage, and rights/provenance research.",
      "components": [
        "mncs",
        "mncds",
        "mncs-fabric",
        "mncs-commons",
        "mncs-harness",
        "mncs-forge",
        "mncs-control",
        "mncs-language",
        "mncs-reference-studies",
        "mnel",
        "ravel",
        "mncs-atlas",
        "mncs-lineage",
        "mncs-rights-provenance"
      ],
      "optional_components": ["mncs-validator-rs"]
    },
    "full": {
      "display_name": "Full",
      "description": "Every registered family component that this host can support.",
      "components": [
        "mncs",
        "mncds",
        "mncs-validator-rs",
        "mncs-fabric",
        "mncs-commons",
        "mncs-harness",
        "mncs-forge",
        "mncs-control",
        "mncs-language",
        "mncs-reference-studies",
        "mnel",
        "ravel",
        "mncs-atlas",
        "mncs-lineage",
        "mncs-rights-provenance"
      ]
    }
  },
  "components": [
    {
      "id": "mncs",
      "display_name": "Machine-Native Complexity Standard",
      "repository": {
        "owner": "epi13",
        "name": "machine-native-complexity-standard",
        "url": "https://github.com/epi13/machine-native-complexity-standard"
      },
      "purpose": "Normative implementation-evidence standard, schemas, conformance corpus, and offline Python validator.",
      "category": "standard",
      "authority_class": "normative-standard",
      "normative": true,
      "role": "standard",
      "optional": false,
      "audiences": ["user", "developer", "researcher"],
      "foundational": true,
      "platforms": ["linux", "windows", "linux-arm"],
      "architectures": ["x86_64", "amd64", "aarch64", "arm64"],
      "unsupported_platforms": ["macos"],
      "dependencies": [],
      "conflicts": [],
      "runtime_requirements": ["python>=3.11"],
      "build_requirements": [],
      "install_strategy": "python-source-venv",
      "automation": "automated",
      "source": {"kind": "git", "default_ref": "main", "ref_policy": "explicit-or-default-branch"},
      "package": {"ecosystem": "python", "name": "mncs-validator", "published": false},
      "binaries": [{"name": "mncs", "entry": "mncs_validator.cli:main"}, {"name": "mncds", "entry": "mncs_validator.mncds_cli:main"}],
      "mcp": [],
      "services": [],
      "config_locations": [],
      "health_checks": [
        {"id": "mncs-version", "kind": "cli-json", "binary": "mncs", "argv": ["version", "--json"]}
      ],
      "update_strategy": "git-pull-and-reinstall",
      "relationships": [
        {"id": "mncds", "kind": "consumes", "note": "May validate a supplied MNCDS development record; does not own MNCDS."}
      ],
      "documentation": {
        "readme": "https://github.com/epi13/machine-native-complexity-standard/blob/main/README.md",
        "docs": "https://epi13.github.io/machine-native-complexity-standard/",
        "agents": "https://github.com/epi13/machine-native-complexity-standard/blob/main/AGENTS.md"
      },
      "maturity": "release-candidate"
    },
    {
      "id": "mncds",
      "display_name": "Machine-Native Complexity Development Specification",
      "repository": {
        "owner": "epi13",
        "name": "machine-native-complexity-development-specification",
        "url": "https://github.com/epi13/machine-native-complexity-development-specification"
      },
      "purpose": "Independently versioned development-process specification and MNCDS-owned validator.",
      "category": "specification",
      "authority_class": "development-specification",
      "normative": true,
      "role": "standard",
      "optional": false,
      "audiences": ["developer", "researcher"],
      "foundational": true,
      "platforms": ["linux", "windows", "linux-arm"],
      "architectures": ["x86_64", "amd64", "aarch64", "arm64"],
      "unsupported_platforms": ["macos"],
      "dependencies": [],
      "conflicts": [],
      "runtime_requirements": ["python>=3.11"],
      "build_requirements": [],
      "install_strategy": "python-source-venv",
      "automation": "automated",
      "source": {"kind": "git", "default_ref": "main", "ref_policy": "explicit-or-default-branch"},
      "package": {"ecosystem": "python", "name": "mncds-validator", "published": false},
      "binaries": [{"name": "mncds", "entry": "mncds_validator.cli:main", "conflict_note": "The MNCS package also exposes an mncds consumer. Prefer the MNCDS-owned validator when both are installed."}],
      "mcp": [],
      "services": [],
      "config_locations": [],
      "health_checks": [
        {"id": "mncds-version", "kind": "cli-json", "binary": "mncds", "argv": ["version", "--json"]}
      ],
      "update_strategy": "git-pull-and-reinstall",
      "relationships": [
        {"id": "mncs", "kind": "validates", "note": "May require an MNCS binding only when a record declares one."}
      ],
      "documentation": {
        "readme": "https://github.com/epi13/machine-native-complexity-development-specification/blob/main/README.md"
      },
      "maturity": "release-candidate"
    },
    {
      "id": "mncs-validator-rs",
      "display_name": "MNCS Rust validator",
      "repository": {
        "owner": "epi13",
        "name": "mncs-validator-rs",
        "url": "https://github.com/epi13/mncs-validator-rs"
      },
      "purpose": "Independent offline Rust validator for supported MNCS 0.2 subsets.",
      "category": "validator",
      "authority_class": "independent-validator",
      "normative": false,
      "role": "development",
      "optional": true,
      "audiences": ["developer", "researcher"],
      "foundational": false,
      "platforms": ["linux", "windows", "linux-arm"],
      "architectures": ["x86_64", "amd64", "aarch64", "arm64"],
      "unsupported_platforms": ["macos"],
      "dependencies": [],
      "conflicts": [],
      "runtime_requirements": [],
      "build_requirements": ["rustc", "cargo"],
      "install_strategy": "cargo-source",
      "automation": "automated",
      "source": {"kind": "git", "default_ref": "main", "ref_policy": "explicit-or-default-branch"},
      "package": {"ecosystem": "cargo", "name": "mncs-validator-rs", "published": false},
      "binaries": [{"name": "mncs-rs", "entry": "mncs-rs"}],
      "mcp": [],
      "services": [],
      "config_locations": [],
      "health_checks": [
        {"id": "mncs-rs-binary", "kind": "binary", "binary": "mncs-rs"}
      ],
      "update_strategy": "git-pull-and-reinstall",
      "relationships": [
        {"id": "mncs", "kind": "validates", "note": "Independent consumer of MNCS schemas and corpus; does not wrap the Python validator."}
      ],
      "documentation": {
        "readme": "https://github.com/epi13/mncs-validator-rs/blob/main/README.md"
      },
      "maturity": "experimental"
    },
    {
      "id": "mncs-language",
      "display_name": "MNCS Language",
      "repository": {
        "owner": "epi13",
        "name": "mncs-language",
        "url": "https://github.com/epi13/mncs-language"
      },
      "purpose": "Research compiler and semantic model for a verification-native language built on MNCS principles.",
      "category": "language",
      "authority_class": "language-research",
      "normative": false,
      "role": "research",
      "optional": true,
      "audiences": ["researcher", "developer"],
      "foundational": false,
      "platforms": ["linux", "windows", "linux-arm"],
      "architectures": ["x86_64", "amd64", "aarch64", "arm64"],
      "unsupported_platforms": ["macos"],
      "dependencies": [],
      "conflicts": [],
      "runtime_requirements": [],
      "build_requirements": ["rustc", "cargo"],
      "install_strategy": "cargo-source",
      "automation": "automated",